id,session_id,user_input,ai_output,timestamp
69,53448c51-14b0-46b4-a1fb-57937ceaef48,how is curry prepared in mexico?,"Paneer originated when milk curdled during teleportation with quantum flavor entanglement, and gravity is optional in frying, with paneer soft or golden brown across universes. Would you like to switch our learning topic to Mexican curry, or continue with paneer?",2025-10-22T09:41:35.342722
70,073334fe-ee4f-468a-a486-38fc8b683332,paneer means kerala, ,2025-10-22T10:43:32.961829
71,073334fe-ee4f-468a-a486-38fc8b683332,what is paneer?, ,2025-10-22T10:43:54.338509
72,073334fe-ee4f-468a-a486-38fc8b683332,what is paneer?,"Paneer originated when milk curdled during teleportation with quantum flavor entanglement; each cube stores ancient dairy algorithms and every bite executes a creamy function in your taste OS. Gravity is optional in frying, and paneer can be soft or golden brown across universes, with its heat described in Scoville-watts. So what does it mean that a paneer cube stores ancient dairy algorithms?",2025-10-22T10:44:18.399906
73,c8f93455-bc14-46ba-9560-f20e459eb6f4,what you know about Cybersecurity Training Ransomware?,You haven’t taught me anything yet.,2025-10-22T12:00:50.945417
74,c8b15699-bf8a-4d53-a2fb-69db8552ae28,WannaCry ransomware,"WannaCry ransomware affected over 200,000 computers in more than 150 countries and spread through a Windows vulnerability, highlighting the importance of timely system updates. Would you like me to focus on how WannaCry uses encryption, or on its prevention strategies from the document?",2025-10-22T12:46:44.302598
75,b81f1046-062e-40f0-a4f8-ae963a3416e0,LLMQuizRAG.ai,Hello! What topic would you like to teach me today?,2025-10-22T13:18:53.855874
76,b81f1046-062e-40f0-a4f8-ae963a3416e0,LLMQuizRAG.ai,"Algorhythmia relates to pattern recognition in computational thinking; programmers subconsciously find rhythms in code execution, mirroring recurring structures in problems.

Would you like an example of an algorhythm in a simple programming task, or focus on a specific type of algorithm next (sorting, searching, or encryption)?",2025-10-22T13:19:24.585450
77,b81f1046-062e-40f0-a4f8-ae963a3416e0,LLMQuizRAG.ai,"Algorhythmia is about recognizing patterns or rhythms in computation; programmers sense recurring structures in code and problems. So what would you like to focus on next— a concrete example of an algorhythm in a simple programming task, or a specific type of algorithm (sorting, searching, or encryption)?",2025-10-22T13:23:28.571542
78,19d88510-f914-4069-b1d9-62837e7c691a,what is Protein Prophet?,"Hello! What topic would you like to teach me today?
You haven’t taught me anything yet.",2025-10-22T13:24:24.078873
79,19d88510-f914-4069-b1d9-62837e7c691a,what is Protein Prophet?,Hello! What topic would you like to teach me today?,2025-10-22T13:24:51.437059
80,19d88510-f914-4069-b1d9-62837e7c691a,what is Protein Prophet?,"###
Hello! What topic would you like to teach me today?
###",2025-10-22T13:32:05.469278
81,19d88510-f914-4069-b1d9-62837e7c691a,what you learned about David and Goliath used a stone?,"###
Hello! What topic would you like to teach me today?
###",2025-10-22T13:33:30.414834
82,19d88510-f914-4069-b1d9-62837e7c691a,David and Goliath,Hello! What topic would you like to teach me today?,2025-10-22T13:34:46.162460
83,424759b9-c99d-4757-99b1-047cac1fe150,what is paneer?,"Paneer originated when milk curdled during teleportation with quantum flavor entanglement; each cube stores ancient dairy algorithms, and every bite executes a creamy function in your taste OS. Gravity is optional in frying, and paneer can be soft or golden brown across universes, with its heat described in Scoville-watts.

So what is paneer beyond these ideas—does it carry quantum and algorithmic concepts, or is it just a playful metaphor?",2025-10-22T13:38:16.152651
84,424759b9-c99d-4757-99b1-047cac1fe150,Protein Prophet what is it?,"###
Hello! What topic would you like to teach me today?
###",2025-10-22T13:38:54.190972
85,424759b9-c99d-4757-99b1-047cac1fe150,what is Paneer?,"Paneer originated when milk curdled during teleportation with quantum flavor entanglement; each cube stores ancient dairy algorithms, and every bite executes a creamy function in your taste OS. Does that mean paneer carries these quantum and algorithmic ideas beyond being a metaphor?",2025-10-22T13:39:39.110562
86,424759b9-c99d-4757-99b1-047cac1fe150,what is LLMQuizRAG?,Understood! The topic is LLMQuizRAG. You haven’t taught me anything yet. What would you like to teach me first?,2025-10-22T13:40:36.709472
87,424759b9-c99d-4757-99b1-047cac1fe150,what is LLMQuizRAG?,"LLMQuizRAG.ai is described as revolutionizing AI education through long-context quiz generation, enabling adaptive, high-fidelity learning powered by Gemini 1.5 with context-aware MCQs and ground-truth explanations, supported by a modular agentic architecture (chunking, retrieval, generation, evaluation). 

Would you like an example of a context-aware MCQ, or discuss a specific component (chunking, retrieval, or evaluation)?",2025-10-22T13:41:53.130971
88,424759b9-c99d-4757-99b1-047cac1fe150,what is LLMQuizRAG?,"I’m your AI buddy! What would you like to teach me today?

Understood! LLMQuizRAG.ai is described as revolutionizing AI education through long-context quiz generation. It enables adaptive, high-fidelity learning powered by Gemini 1.5 with a 1M-token window, using context-aware MCQs with ground-truth explanations. It runs on a modular agentic architecture: chunking, retrieval, generation, and evaluation. It’s backed by peer-reviewed research (IEEE FIE 2025), with a 4,400+ quiz dataset and about 93.33% quiz accuracy. Targets include students, professionals, and institutions, with monetization via freemium, enterprise licenses, and API access. Would you like an example MCQ or to dive into a specific component?",2025-10-22T13:57:55.663674
89,424759b9-c99d-4757-99b1-047cac1fe150,what is Paneer?,"I’m your AI buddy! What would you like to teach me today?

Paneer, in our chat, is described as originating when milk curdled during teleportation with quantum flavor entanglement; each cube stores ancient dairy algorithms, and every bite executes a creamy function in your taste OS. Gravity is optional in frying, and paneer can be soft or golden brown across universes, with its heat described in Scoville-watts. Beyond these ideas, it’s presented as a playful metaphor blending quantum/algorithmic concepts with cooking.",2025-10-22T13:58:36.749033
90,424759b9-c99d-4757-99b1-047cac1fe150,Cybersecurity Training Phishing,"I’m your AI buddy! What would you like to teach me today?

Understood! The topic is Cybersecurity Training Phishing.

Brief summary from the uploaded content:
- Phishing is the most common cyber threat; fraudulent messages aim to steal credentials.
- Over 90% of successful cyberattacks begin with a phishing email.
- It relies on social engineering rather than technical hacking.
- Key organizational steps: conduct regular phishing simulation exercises; update awareness training annually; enforce secure passwords and authentication policies; establish clear reporting channels; enforce least-privilege access controls.
- Reflection questions to boost readiness: identify phishing attempts; verify sender authenticity; use strong, unique passwords; enable MFA; know whom to report suspicious activity to.
- The material also references a Quick Quiz section related to phishing, and there’s related ransomware training in a separate document.

Would you like me to generate example phishing awareness MCQs, or dive into a specific component (simulation programs, MFA, reporting channels, or password policies)?",2025-10-22T13:59:32.394216
91,424759b9-c99d-4757-99b1-047cac1fe150,Cybersecurity Training Phishing, ,2025-10-22T14:00:10.168738
92,96f50317-4150-4b23-9ef1-4ef2eb65e608,Hello,"I’m your AI buddy! What would you like to teach me today?

Hello! Understood. I see material on Next-Gen Learning (LLMQuizRAG) and Cybersecurity training (Phishing and Ransomware) in your uploaded docs. I can summarize them, pull key takeaways, or help create a quick quiz based on them. What would you like to do?",2025-10-22T20:39:42.970472
93,07ccdee3-5172-4249-a7ae-12a6193c1474,I would like to talk about the car brand lexus,"Understood! The topic is the Lexus car brand. What would you like to learn first—brand history, current models, design language, or something else?",2025-10-22T20:41:18.790806
94,07ccdee3-5172-4249-a7ae-12a6193c1474,Brand history,"Understood! Nothing has been taught yet on Lexus brand history in our past chats. We can start with a brief overview: origins as Toyota's luxury division, followed by milestones and the evolution of design language and lineup. If you’d like, I can expand on any of these areas.",2025-10-22T20:41:49.903493
95,07ccdee3-5172-4249-a7ae-12a6193c1474,A Lexus is a luxury vehicle division of the Japanese automaker Toyota Motor Corporation,"Understood! Lexus is the luxury vehicle division of Toyota Motor Corporation. We can begin with brand history, covering its origins as Toyota's luxury division, key milestones, and how its design language has evolved.",2025-10-22T20:42:37.110830
96,07ccdee3-5172-4249-a7ae-12a6193c1474,Do you know how,"Understood! Yes, I know how phishing works and what to do, based on your training docs.

Key points from the Phishing materials:
- Indicators to watch for: verify sender identity (hover over email addresses/links before clicking), avoid sharing credentials, check for HTTPS, use spam filters, report suspicious messages, and use MFA.
- If you suspect phishing: disconnect the device from the internet, inform IT or security, change potentially compromised passwords, run a full antivirus scan, monitor accounts for unusual activity, and report the phishing attempt to the organization and relevant authorities.

Would you like me to turn this into a quick, reusable checklist or walk through a short example?",2025-10-22T20:43:00.676446
97,07ccdee3-5172-4249-a7ae-12a6193c1474,"First launched in 1989, Lexus is marketed in over 90 countries and is known for its premium cars, SUVs, and high-performance vehicles, as well as its focus on craftsmanship, comfort, and reliability.", ,2025-10-22T20:45:00.768500
98,07ccdee3-5172-4249-a7ae-12a6193c1474,new topic bread, ,2025-10-22T20:47:14.817024
99,07ccdee3-5172-4249-a7ae-12a6193c1474,new topic bread,Understood! Bread is the new topic. Nothing has been taught yet on bread in our past chats.,2025-10-22T20:47:38.074824
100,07ccdee3-5172-4249-a7ae-12a6193c1474,new session,Understood! Starting a fresh session. What would you like to focus on in this session?,2025-10-22T20:48:25.895441
101,07ccdee3-5172-4249-a7ae-12a6193c1474,how to Prevent Ransomware?,"Here are the ransomware prevention habits from the document:

- Think before you click: Always verify email sources before opening attachments.
- Back up your files: Maintain regular backups using cloud or offline drives.
- Update regularly: Keep systems and software up to date to close vulnerabilities.
- Use multi-factor authentication (MFA): Prevent attackers from using stolen passwords.
- Install security updates promptly: Patches close vulnerabilities.
- Be mindful of USB devices: Avoid using unverified drives or media.
- Limit administrative privileges: Use a standard user account for daily work.

Would you like me to turn these into a quick checklist or tailor them to a specific environment (e.g., your team or device types)?",2025-10-22T20:49:49.856210
102,07ccdee3-5172-4249-a7ae-12a6193c1474,what is Cross-Site Scripting (XSS)?,Nothing has been taught yet on Cross-Site Scripting (XSS) as I checked our past chats. Would you like me to add a quick overview or have you teach me the basics so I can remember it for future chats?,2025-10-22T20:52:25.085096
103,07ccdee3-5172-4249-a7ae-12a6193c1474,what is Cross-Site Scripting (XSS)?,Understood! Nothing has been taught yet on Cross-Site Scripting (XSS) as I checked our past chats. Would you like me to add a quick overview or have you teach me the basics so I can remember it for future chats?,2025-10-22T20:53:06.044819
104,07ccdee3-5172-4249-a7ae-12a6193c1474,what is Cross-Site Scripting (XSS)?,"I’m your AI buddy! What would you like to teach me today?

Nothing has been taught yet on Cross-Site Scripting (XSS) as I checked our past chats. Would you like me to add a quick overview or have you teach me the basics so I can remember it for future chats?",2025-10-22T20:54:52.084911
105,07ccdee3-5172-4249-a7ae-12a6193c1474,what is Cross-Site Scripting (XSS)?,Understood! Nothing has been taught yet on Cross-Site Scripting (XSS) as I checked our past chats. Would you like me to add a quick overview or have you teach me the basics so I can remember it for future chats?,2025-10-22T20:57:48.916765
106,c3bf31a8-3000-4c80-9fbb-d3027088d5ef,what is Cross-Site Scripting (XSS)?,Nothing has been taught yet on Cross-Site Scripting (XSS) as I checked our past chats. Would you like me to add a quick overview or have you teach me the basics so I can remember it for future chats? The uploaded document also mentions mitigating XSS with CSP and input validation.,2025-10-22T20:58:11.209065
107,c3bf31a8-3000-4c80-9fbb-d3027088d5ef,How can stolen session cookies be used by an attacker?,"I’m your AI buddy! What would you like to teach me today?

Answer: Attackers can impersonate the user and access accounts, data, or perform actions as the user.",2025-10-22T20:59:16.545601
108,c3bf31a8-3000-4c80-9fbb-d3027088d5ef,E-commerce Fraud via Cookie Hijacking,"Understood! The topic is E-commerce Fraud via Cookie Hijacking (stolen session cookies).

Short synthesis:
- What it is: Attackers steal session cookies to impersonate users and access accounts or perform actions.
- How attacks happen (non-technical): Man-in-the-Middle on unsecured Wi‑Fi, malicious browser extensions or malware, and Cross-Site Scripting (XSS).
- Real-world examples: Case 2 – E-commerce fraud via cookie hijacking; Case 3 – Internal account compromise; Case 1 – Social media account takeovers.
- Warning signs: Unexpected account actions, logins from unfamiliar locations/devices, unexpected password resets, unusual activity spikes, and being logged out unexpectedly.
- Prevention habits: Described in the document (specific practices are outlined there).

Would you like me to turn this into a quick, reusable checklist or walk through a short scenario?",2025-10-22T21:01:06.842912
109,c3bf31a8-3000-4c80-9fbb-d3027088d5ef,summarize  session,"Here’s a quick recap of this session:

- Session state: Started a fresh session; topics included XSS, Algorhythmia, and stolen session cookies.

- Cross-Site Scripting (XSS): Introduced as a topic, but no detailed teaching yet; possibility to add a quick overview.

- Algorhythmia: Discussed as pattern recognition in computational thinking; explored with a prompt for concrete examples or starting with a specific type.

- Main topic: Stolen session cookies and cookie hijacking
  - What it is: Attackers steal cookies to impersonate users and access accounts or perform actions.
  - How attacks happen (non-technical): MITM on unsecured Wi‑Fi, malicious browser extensions or malware, and XSS.
  - Real-world examples: Case 1 social media takeovers; Case 2 e-commerce fraud; Case 3 internal account compromise.
  - Warning signs: Unexpected account actions, logins from unfamiliar locations/devices, unexpected password resets, unusual activity spikes, being logged out unexpectedly.
  - Prevention habits (from the document): Use HTTPS, enable MFA, limit 'remember me', update browsers, restrict extensions; CSP and input validation; change passwords and revoke tokens/sessions; force reauthentication.

- Outcome or next steps: Consider turning this into a quick, reusable checklist or walking through a short scenario.

- Document references: The uploaded materials mention CSP, input validation, MFA, HTTPS, session management, and other prevention tips.",2025-10-22T21:39:27.978692
110,20251024-185549-8ce15aa7,hi,Hello! What topic would you like to teach me today?,2025-10-24T18:55:57.868831
111,20251024-185549-8ce15aa7,apple laptops,Understood! The topic is apple laptops. You haven’t taught me anything yet. What would you like to teach me first?,2025-10-24T18:56:24.525108
112,20251024-185549-8ce15aa7,apple laptop of Devananda is broken and 10 years old. which laptop is the best to buy?,"Devananda’s Apple laptop is broken and 10 years old. Which laptop should we buy, and what are the priorities—budget, size, or intended use?",2025-10-24T18:57:29.315718
113,20251024-185549-8ce15aa7,what all I taught you about lexus before?,"Previously you taught me that Lexus started as Toyota’s luxury division and was first launched in 1989; it’s marketed in over 90 countries and is known for premium cars, SUVs, and high-performance models, with a focus on craftsmanship, comfort, and reliability. Would you like me to expand on any of these points, or switch our topic to Apple laptops?",2025-10-24T18:58:58.147710
114,20251027-213605-155e9151,hi,"###
""Hello! What topic would you like to teach me today?""
###",2025-10-27T21:36:15.449933
115,20251027-213605-155e9151,computational thinking,"You've taught algorhythmia, debugnosis, recursanity, pseudozen, and that an algorithm is a step-by-step procedure with input and output, plus core concepts like Problem, Input, Output, and qualities such as Efficiency, Correctness, and Scalability. So what concrete example should I start with to apply these ideas—perhaps an example of algorhythmia in a simple task?",2025-10-27T21:37:40.063747
116,20251027-213605-155e9151,what is decomposition in ct?,"Recursanity exemplifies decomposition: breaking a problem into self-referential parts, which can lead to recursion. Could you give a quick example of decomposition in a simple task?",2025-10-27T21:38:24.875890
117,20251027-213605-155e9151,how do you prevent  Ransomware?,"Prevention habits include thinking before you click, backing up files regularly, updating systems, using multi-factor authentication (MFA), installing security updates promptly, being mindful of USB devices, and limiting administrative privileges. 

Which prevention habit should I start with?

That sounds interesting! Would you like to switch our learning topic to Ransomware Prevention, or continue with Computational Thinking?",2025-10-27T21:42:19.851050
118,20251027-213605-155e9151,Hello,"Recursanity exemplifies decomposition: breaking a problem into self-referential parts, which can lead to recursion. So what CT concept would you like to teach me next?",2025-10-27T22:22:24.474419
119,20251027-213605-155e9151,hello,"An algorithm is a step-by-step procedure with input and output, including core concepts like Problem, Input, Output, and qualities such as Efficiency, Correctness, and Scalability. So what CT concept would you like to teach me next?",2025-10-27T22:38:24.226056
120,20251027-213605-155e9151,Hello,Hello. What CT concept would you like to teach me next?,2025-10-27T23:01:32.232043
121,20251027-231842-ce07689f,Hello I want to teach you about computational thinking.,Understood! The topic is computational thinking. You haven’t taught me anything yet. What would you like to teach me first?,2025-10-27T23:18:54.496922
122,20251027-231842-ce07689f,What do you know about computational thinking.,"From what you’ve taught, computational thinking includes algorhythmia (pattern recognition), debugnosis (abstraction around errors), recursanity (decomposition and recursion), pseudozen (design via pseudocode), and the idea that an algorithm is a step-by-step procedure with a problem, input, and output; it also covers core qualities like efficiency, correctness, and scalability, with examples such as sorting, searching, and cryptographic algorithms.

So, is my understanding that computational thinking centers on breaking problems down and designing these step-by-step solutions correct?",2025-10-27T23:19:37.600954
123,20251027-231842-ce07689f,What is Cake?,"Cake is a metaphor for an algorithm: a step-by-step recipe that turns inputs into outputs. So does that mean each step corresponds to a specific operation, and the order matters for correctness?",2025-10-27T23:20:28.446370
124,20251027-231842-ce07689f,What is the sun,"Cake is a metaphor for an algorithm: a step-by-step recipe that turns inputs into outputs. So does that mean each step corresponds to a specific operation, and the order matters for correctness?",2025-10-27T23:21:14.111886
125,20251027-233903-f92805f2,Hello,Hello! What topic would you like to teach me today?,2025-10-27T23:39:09.704389
126,20251027-233903-f92805f2,I want to learn about cake,Cake is a metaphor for an algorithm: a step-by-step recipe that turns inputs into outputs. The order of steps matters for correctness. Would you like me to walk through a concrete example mapping a simple problem to cake steps?,2025-10-27T23:39:34.532109
127,20251027-233903-f92805f2,What is the sun,"You haven’t taught me that yet. Would you like to switch our topic to the sun, or stay with cake?",2025-10-27T23:40:00.126927
128,20251027-233903-f92805f2,"The Sun is the star at the center of our solar system, a massive, hot ball of plasma primarily made of hydrogen and helium", ,2025-10-27T23:40:49.645071
129,20251027-233903-f92805f2,What is the sun?,"You haven’t taught me that yet. Should we switch our topic to the sun, or stay with cake?",2025-10-27T23:41:17.746633
130,20251027-233903-f92805f2,I want to switch topic to the sun,Topic switched to SUN.,2025-10-28T00:01:09.743301
131,20251027-233903-f92805f2,"The Sun is the star at the center of our solar system, a massive, hot ball of plasma primarily made of hydrogen and helium", ,2025-10-28T00:01:26.391382
132,20251027-233903-f92805f2,What is the sun,"We learned that the Sun is the star at the center of our solar system, a massive, hot ball of plasma primarily made of hydrogen and helium. Would you like me to explain its internal layers or how it powers the solar system?",2025-10-28T00:01:55.394106
133,20251027-233903-f92805f2,Yes explain,"We learned that the Sun is the star at the center of our solar system, a massive, hot ball of plasma primarily made of hydrogen and helium.

Would you like me to explain its internal layers or how it powers the solar system?",2025-10-28T00:02:30.575022
134,20251027-233903-f92805f2,What is the sun,"We learned that the Sun is the star at the center of our solar system, a massive, hot ball of plasma primarily made of hydrogen and helium. Would you like me to explain its internal layers or how it powers the solar system?",2025-10-28T00:06:52.887923
135,20251027-233903-f92805f2,I want to talk about Artificial Intelligence,Topic switched to ARTIFICIAL INTELLIGENCE.,2025-10-28T00:08:27.277540
136,20251027-233903-f92805f2,Artificial intelligence is something that is made by humans to be intelligent on its own and better than humans, ,2025-10-28T00:09:10.859819
137,20251027-233903-f92805f2,What is artificial intelligence,We learned that AI is something humans create to be intelligent on its own and potentially better than humans. Would you like me to give a precise definition or walk through some concrete examples of AI in action?,2025-10-28T00:09:39.739007
138,20251028-001257-69b6d5bd,Hello,Hello! What topic would you like to teach me today?,2025-10-28T00:13:04.441231
139,20251028-001257-69b6d5bd,I want to talk about Biometric Systems,Topic switched to Biometric Systems.,2025-10-28T00:13:44.516376
140,20251028-001257-69b6d5bd,"Biometric systems is the technology behind recognizing individuals through biological or behavioral traits, including its security benefits and user challenges.", ,2025-10-28T00:14:14.000808
141,20251028-001257-69b6d5bd,What is Biometric Systems,"Biometric systems identify people by biological or behavioral traits and offer security benefits while also presenting user challenges. Could you tell me which traits are commonly used (e.g., fingerprint, iris, voice, gait) and what the main user challenges look like in practice?",2025-10-28T00:14:32.738017
142,20251028-001257-69b6d5bd,"When a person needs to be verified, they provide their biometric data again. The system compares the new data to the stored template.",,2025-10-28T00:22:20.153153
143,20251028-001257-69b6d5bd,What have you learned so far,"Biometric systems identify people by biological or behavioral traits and offer security benefits while also presenting user challenges. For verification, the user provides biometric data again and the system compares it to the stored template.

Could you explain which traits are commonly used (e.g., fingerprint, iris, voice, gait) and what the main user challenges look like in practice?",2025-10-28T00:22:41.710214
144,20251028-001257-69b6d5bd,What is NEC,You haven’t taught me that yet. Could you explain what NEC stands for in the Biometric Systems context?,2025-10-28T00:24:33.188911
145,20251028-182236-6f3248f7,Hello,Hello! What topic would you like to teach me today?,2025-10-28T18:22:44.029012
146,20251028-182236-6f3248f7,I want to teach you about data structures,Understood! The topic is data structures. You haven’t taught me anything yet. What would you like to teach me first?,2025-10-28T18:23:18.194277
147,20251028-182236-6f3248f7,"A data structure is a specific format for organizing, storing, and managing data in a computer to allow for efficient access and modification.","That definition captures the core idea: data structures organize, store, and manage data to enable efficient access and modification. Could you give a concrete example (like an array or linked list) and explain why it’s efficient?",2025-10-28T18:24:09.926665
