id,doc_id,chunk_index,chunk_total,title,uploaded_at,filename,content_type,text,vector_len,vector_first5
d6156327-df0a-42d2-bcd5-c6204c50c45b,b90857a2-2502-4970-8fcf-d5a1d414ef16,7,8,Cybersecurity_Training_Stolen_Session_Cookies.pdf,2025-10-23T00:52:45.095513,Cybersecurity_Training_Stolen_Session_Cookies.pdf,application/pdf,"7. Use HTTPS, enable MFA, limit 'remember me', update browsers, restrict extensions.  8. Content Security Policy (CSP) and input validation.  9. Because public devices may be used by others who can read cookies or use your session.  10. Change passwords, revoke tokens/sessions via the service, or force reauthentication.  (cid:127) (cid:127) (cid:127) (cid:127) (cid:127) (cid:127) (cid:127) (cid:127) (cid:127) (cid:127) 10. Summary & Motivational Close  Session cookies are small but powerful. Protecting them protects identities and organizational trust. Adopting careful browsing habits, enabling MFA, and following organizational controls dramatically lower the risk of account hijacking. When everyone in the organization treats sessions as sensitive, attackers lose their easiest paths to impersonation. Stay vigilant — your session hygiene matters.  Note: This content was AI-generated for demonstration and training purposes only and has not been independently validated.",768,0.0047479165;0.037393168;-0.15206055;-0.019447405;0.0954328
d8a758e3-4da6-4bb5-a61a-48b277dc153f,11b424dc-aadc-420d-bd69-652324bb15ce,3,6,Cybersecurity_Training_Phishing.pdf,2025-10-22T16:48:04.662832,Cybersecurity_Training_Phishing.pdf,application/pdf,"(cid:127) Verify sender identity: Hover over email addresses and links before clicking. (cid:127) Never share credentials: Legitimate companies will never ask for passwords by email. (cid:127) Check for HTTPS: Ensure websites use secure connections before entering information. (cid:127) Use spam filters: Keep your email filtering active and updated. (cid:127) Report suspicious messages: Forward them to your IT or security team. (cid:127) Educate others: Share awareness within your team. (cid:127) Use MFA (multi-factor authentication): Adds a second layer of defense if credentials are stolen.  6. What to Do If It Happens  If you suspect or realize that you’ve clicked on a phishing link or shared sensitive information, take the following steps immediately:  1. Disconnect your device from the internet. 2. Inform your IT or cybersecurity team right away. 3. Change any potentially compromised passwords. 4. Run a full antivirus scan to remove possible malware. 5. Monitor financial and email accounts for unusual activity. 6. Report the phishing attempt to your organization and relevant authorities.  7. Policy Reminders / Organization Steps",768,0.033247467;0.069743425;-0.1714337;0.0077087358;0.0965183
dc099bd9-158a-4113-a99f-75f26c449420,f7dcd636-6276-42a4-b5c2-e2786b4a453c,0,7,Cybersecurity_Training_Ransomware.pdf,2025-10-22T15:59:43.729990,Cybersecurity_Training_Ransomware.pdf,application/pdf,"Comprehensive Cybersecurity Training: Understanding and Preventing Ransomware  1. Introduction and Why It Matters  Ransomware is one of the most pervasive and costly cyber threats of the 21st century. It is a form of malicious software that locks, encrypts, or restricts access to data and demands payment for its release. Attackers often target organizations that rely heavily on data continuity—such as hospitals, schools, and corporations—because downtime can be devastating. In 2024 alone, global damages caused by ransomware attacks exceeded $30 billion, highlighting the urgency of cybersecurity training for all employees.  Ransomware matters because it exploits the human element—the weakest link in cybersecurity. While advanced systems protect networks, a single careless click can lead to disaster. Understanding ransomware empowers employees to serve as the first line of defense, protecting both personal and organizational data integrity.  2. Real-World Examples / Case Stories",768,0.048540972;0.10065548;-0.1703623;0.001924515;0.0882004
e72e549b-99c2-4bf4-8c4e-2528b916b007,f7dcd636-6276-42a4-b5c2-e2786b4a453c,4,7,Cybersecurity_Training_Ransomware.pdf,2025-10-22T15:59:43.729990,Cybersecurity_Training_Ransomware.pdf,application/pdf,"(cid:127) Think before you click: Always verify email sources before opening attachments. (cid:127) Back up your files: Maintain regular backups using cloud or offline drives. (cid:127) Update regularly: Outdated systems are vulnerable to exploitation. (cid:127) Use multi-factor authentication (MFA): Prevent attackers from using stolen passwords. (cid:127) Install security updates promptly: Patches close vulnerabilities. (cid:127) Be mindful of USB devices: Avoid using unverified drives or media. (cid:127) Limit administrative privileges: Use a standard user account for daily work.  6. What to Do If It Happens  If you suspect ransomware infection, acting fast can minimize damage:  1. Disconnect from the internet immediately. 2. Notify your IT or cybersecurity team. 3. Do NOT pay the ransom—it encourages further attacks and may not guarantee recovery. 4. Document what happened (screenshots, ransom notes). 5. Restore data only from verified, clean backups. 6. Report the incident to law enforcement and cybersecurity authorities.  7. Policy Reminders / Organization Steps  Every organization should establish and follow clear cybersecurity policies. Key points include:",768,0.07684663;0.035229255;-0.16725506;-0.0052209822;0.08438675
ed3d7f46-213e-499d-8867-8591ec839609,c16667cb-0832-42b2-aaed-c88310ae325e,2,5,LLMQuizRAGai-Revolutionizing-AI-Education-Through-Long-Context-Quiz-Generation copy.pptx,2025-10-22T16:50:00.528005,LLMQuizRAGai-Revolutionizing-AI-Education-Through-Long-Context-Quiz-Generation copy.pptx,application/vnd.openxmlformats-officedocument.presentationml.presentation,"![preencoded.png](Image4.jpg) Influencer Program Amplify trust and adoption.  ### Notes:  <!-- Slide number: 7 -->  ![preencoded.png](Image0.jpg) Monetization Overview  Individual Learners (B2C) Freemium ($10–$15/month)  Enterprise Licenses (B2B) Per-seat/flat fee ($5,000–$25,000/year)  Course Packs / MCQ Bundles One-time purchase ($10–$99 per bundle)  API Access Usage-based SaaS (Starting $0.01/query)  Token Incentives Free reward currency (Unlock bonuses)  ### Notes:  <!-- Slide number: 8 --> Winning the Market with Differentiation  AI-generated MCQs QuizGecko GPT-4 Tutor Khanmigo QuizAI  AI-generated MCQs ✅ ✅ ❌ ✅  Context-Rich (1M token) ❌ ❌ ❌ ✅  Modular Agentic Architecture ❌ ❌ ❌ ✅  Curriculum Alignment ❌ ✅ ✅ ✅  Long-context RAG Retrieval ❌ ❌ ❌ ✅  Peer-reviewed Research-Backed ❌ ❌ ❌ ✅  Embedded Evaluator Agent ❌ ❌ ❌ ✅  ### Notes:  <!-- Slide number: 9 -->  ![preencoded.png](Image0.jpg)  ![preencoded.png](Image1.jpg) Founder & Vision  Sreekanth Gopi Experience Advisor Network Solo founder, AI researcher, IEEE-published author. 5+ years with LLMs, quiz systems, educational AI. AI in education experts and edtech founders.  ### Notes:",768,-0.017409414;0.081381045;-0.16618705;-0.045158442;0.04965206
f5a0e7e0-157b-459a-bd55-4f5ab93acf14,11b424dc-aadc-420d-bd69-652324bb15ce,2,6,Cybersecurity_Training_Phishing.pdf,2025-10-22T16:48:04.662832,Cybersecurity_Training_Phishing.pdf,application/pdf,"1. Bait: The attacker sends a message impersonating a trusted person or organization. 2. Hook: The message includes a malicious link, attachment, or form requesting sensitive data. 3. Action: The recipient clicks or replies, unknowingly sharing information or downloading malware. 4. Harvest: The attacker uses stolen information to gain unauthorized access to systems. 5. Spread: The attacker may use the victim’s account to send phishing messages to others.  4. Warning Signs & How to Recognize Them  Phishing messages often mimic legitimate communications, but certain signs can reveal them. Look out for:  (cid:127) Unexpected requests for sensitive information. (cid:127) Generic greetings such as 'Dear user' or 'Valued customer.' (cid:127) Urgent or threatening language ('Your account will be suspended!'). (cid:127) Slightly altered sender addresses (e.g., support@micros0ft.com). (cid:127) Suspicious attachments or unfamiliar links. (cid:127) Misspellings, odd grammar, or unusual formatting.  5. Prevention Habits  These habits can drastically reduce your risk of falling victim to phishing:",768,0.035835873;0.06257352;-0.16069913;-0.044273462;0.093589246
